{
  "coordinate": {
    "sourceId": "11111111-1111-4111-8111-111111111111",
    "sourceVersion": "sha256:68fc3e599c5dcb5523a2d65c2d9586bfbec34d8b0dae0660659cf8b965533b13",
    "projectionId": "80000000-0000-4000-8000-000000000001",
    "manifestVersion": "manifest-v1",
    "connectorId": "connectors/tabular-reader-v1",
    "connectorVersion": "1.0.0",
    "connectorCapabilityHash": "ccca6841c2a5d15058240039228b22351d60e6279bdcef5f1b78f687b7114ade",
    "authorizationScopeId": "authorized-assets",
    "policyHash": "bbbbbbbbbbbbbbbbbbbbbbbbbbbbbbbbbbbbbbbbbbbbbbbbbbbbbbbbbbbbbbbb",
    "taxonomyVersion": "1.0.0",
    "pipelineVersion": "1.0.0",
    "methodSetHash": "dddddddddddddddddddddddddddddddddddddddddddddddddddddddddddddddd",
    "evidenceCutoff": "2026-01-01T00:09:00Z",
    "revocationEpoch": 0
  },
  "traceId": "eeeeeeeeeeeeeeeeeeeeeeeeeeeeeeee",
  "query": "Which validated grain and relationships are safe for planning?",
  "items": [
    {
      "subject": "Primary dataset grain",
      "summary": "One record per scoped business object and event time.",
      "contentProvenance": "service-generated",
      "score": 0.96,
      "scoreComponents": {
        "lexical": 0.82,
        "semantic": 0.94,
        "maturity": 1.0
      },
      "confidence": 0.99,
      "maturity": "validated",
      "validity": {
        "validFrom": "2026-01-01T00:00:00Z",
        "validUntil": null
      },
      "evidenceRefs": [
        "77777777-7777-4777-8777-777777777777"
      ],
      "counterEvidenceRefs": [],
      "warnings": []
    }
  ],
  "coverageReceipt": {
    "authorizedCandidatesConsidered": 3,
    "returnedItems": 1,
    "caveatsConsidered": 1,
    "returnedCaveats": 1,
    "conflictsConsidered": 1,
    "returnedConflicts": 1,
    "omittedBySection": {
      "items": 2,
      "caveats": 0,
      "conflicts": 0
    },
    "truncated": true,
    "reason": "token-budget"
  },
  "caveats": [
    {
      "summary": "Quality observations apply only to the sealed evidence cutoff.",
      "contentProvenance": "service-generated",
      "evidenceRefs": [
        "aaaaaaaa-aaaa-4aaa-8aaa-aaaaaaaaaaaa"
      ]
    }
  ],
  "conflicts": [
    {
      "subject": "Candidate relationship",
      "claim": "The candidate relationship has both supporting and counter-evidence and is withheld from automatic planning.",
      "contentProvenance": "service-generated",
      "supportingEvidenceRefs": [
        "88888888-8888-4888-8888-888888888888"
      ],
      "counterEvidenceRefs": [
        "99999999-9999-4999-8999-999999999999"
      ]
    }
  ],
  "responsePolicy": {
    "maximumSerializedBytes": 10485760,
    "maximumTextCharacters": 4000,
    "defaultContentProvenance": "source-derived",
    "serviceGeneratedPathPatterns": [
      "/responsePolicy",
      "/traceId",
      "/coordinate",
      "/coverage",
      "/coverageReceipt",
      "/receipt",
      "/hashAlgorithm",
      "/resultHash"
    ],
    "sourceDerivedPathPatterns": [
      "/summary",
      "/assets/*/name",
      "/assets/*/purpose",
      "/assets/*/domain",
      "/assets/*/fields/*/businessMeaning",
      "/businessModel",
      "/modelPatterns",
      "/capabilities",
      "/retrievalHints",
      "/warnings",
      "/items/*/subject",
      "/items/*/summary",
      "/caveats/*/summary",
      "/conflicts",
      "/rows/*"
    ]
  }
}
